Название,Автор,Издательство,Цена со скидкой,Цена без скидки,Процент скидки,Наличие на складе
Новые возможности JavaScript. Как написать чистый код по всем правилам современного языка,Краудер Ти Джей,Бомбора:Мировой компьютерный бестселлер,1772,2427,27,На складе
JavaScript. Креативное программирование. Учебное пособие для вузов,Янцев Валерий Викторович,Лань:Компьютеры и программное обеспечение,3013,Цена без скидки не указана,Скидка отсутствует,Ограничено
JavaScript. Креативное программирование. Учебное пособие,Янцев Валерий Викторович,Лань:Компьютеры и программное обеспечение,2621,Цена без скидки не указана,Скидка отсутствует,Ограничено
Программирование. Лабораторный практикум. Учебное пособие,Рацеев Сергей Михайлович,Лань:Компьютеры и программное обеспечение,1352,Цена без скидки не указана,Скидка отсутствует,На складе
Программирование. Лабораторный практикум. Учебное пособие,Рацеев Сергей Михайлович,Лань:Компьютеры и программное обеспечение,1175,Цена без скидки не указана,Скидка отсутствует,На складе
Программирование. Основы Python для инженеров. Учебное пособие для вузов,"Никитина Татьяна Павловна, Королев Леонид Владимирович",Лань:Компьютеры и программное обеспечение,1592,Цена без скидки не указана,Скидка отсутствует,Ограничено
Программирование. Основы Python. Учебное пособие для СПО,"Никитина Татьяна Павловна, Королев Леонид Владимирович",Лань:Компьютеры и программное обеспечение,1386,Цена без скидки не указана,Скидка отсутствует,Ограничено
Разработка приложений с графическим пользовательским интерфейсом на языке Python. Учебное пособие,"Букунов Сергей Витальевич, Букунова Ольга Викторовна",Лань:Компьютеры и программное обеспечение,808,Цена без скидки не указана,Скидка отсутствует,Ограничено
Создание микросервисов,Ньюмен Сэм,Питер:Бестселлеры O`Reilly,3050,3910,22,На складе
Усовершенствованные структуры данных,Брасс Петер,ДМК-Пресс,3071,5583,45,На складе
Рекурсивная книга о рекурсии,Свейгарт Эл,Питер:Библиотека программиста,2268,2908,22,На складе
MySQL по максимуму,"Ботрос Сильвия, Тинли Джереми",Питер:Бестселлеры O`Reilly,2921,3745,22,На складе
Software. Ошибки и компромиссы при разработке ПО,"Лелек Томаш, Скит Джон",Питер:Библиотека программиста,3262,4182,22,На складе
Python для хакеров. Нетривиальные задачи и проекты,Воган Ли,Питер:Библиотека программиста,1972,2528,22,На складе
Методы линейного программирования,Божко Аркадий Николаевич и др.,Издательство МГТУ им. Н.Э.Баумана,448,814,45,На складе
Освоение Lightning Network. Протокол второслойной блочной цепи для мгновенных Bitcoin-платежей,Антонопулос Андреас М. и др.,ДМК-Пресс,3071,5583,45,На складе
Паттерны проектирования API,Гивакс Джей Джей,Питер:Библиотека программиста,3334,4274,22,На складе
Apache Kafka. Потоковая обработка и анализ данных,Шапира Гвен и др.,Питер:Бестселлеры O`Reilly,3086,3956,22,На складе
Python и анализ данных,МакКинни Уэс,ДМК-Пресс,2764,5026,45,На складе
Алгоритмы,Эриксон Джефф,ДМК-Пресс,3071,5583,45,На складе
Алгоритмы принятия решений,Кохендерфер Майкл и др.,ДМК-Пресс,3838,6979,45,На складе
Структура и интерпретация классической механики,"Сассман Джеральд Джей, Уиздом Джек",ДМК-Пресс,2303,4187,45,На складе
Идиомы bash,"Олбинг Карл, Фоссен Джей Пи",Питер:Бестселлеры O`Reilly,1417,1817,22,На складе
Алгоритмы биоинформатики,"Компо Филлип, Певзнер Павел",ДМК-Пресс,3685,6700,45,На складе
Предварительная подготовка данных в Python. Том 1. Инструменты и валидация,Груздев Артем Владимирович,ДМК-Пресс,3685,6700,45,На складе
"Предварительная подготовка данных в Python. Том 2. План, примеры и метрики качества",Груздев Артем Владимирович,ДМК-Пресс,3685,6700,45,На складе
Прогнозирование. Принципы и практика,"Хайндман Роб, Атанасопулос Джордж",ДМК-Пресс,2764,5026,45,На складе
Прикладные нейро-нечеткие вычислительные системы и устройства,Бобырь Максим Владимирович и др.,ИНФРА-М:Научная мысль,1774,3226,45,На складе
"Красивый C++. 30 главных правил чистого, безопасного и быстрого кода","Дэвидсон Дж. Гай, Грегори Кейт",Питер:Для профессионалов,2823,3619,22,На складе
Глубокое обучение с R и KERAS,Шолле Франсуа,ДМК-Пресс,3071,5583,45,На складе
Power BI. Передовые методы оптимизации,Мерчант Бхавик,ДМК-Пресс,2149,3908,45,На складе
"Разработка веб-приложений GraphQL с React, Node.js и Neo4j",Лион Уильям,ДМК-Пресс,2303,4187,45,На складе
Основы алгоритмизации и программирования на Python. Учебное пособие,Гуриков Сергей Ростиславович,ИНФРА-М:Высшее образование. Бакалавриат,2943,5350,45,На складе
Unity в действии. Мультиплатформенная разработка на C#,Хокинг Джозеф,Питер:Для профессионалов,2070,2654,22,На складе
Объекты. Стильное ООП,Нобак Маттиас,Питер:Библиотека программиста,2114,2710,22,На складе
Kafka Streams и ksqlDB. Данные в реальном времени,Сеймур Митч,Питер:Библиотека программиста,2397,3073,22,На складе
Алгоритмы на практике. Решение реальных задач,Зингаро Даниэль,Питер:Библиотека программиста,2057,2637,22,На складе
Современная программная инженерия. ПО в эпоху эджайла и непрерывного развертывания,Фарли Дэвид,Питер:Для профессионалов,2340,3000,22,На складе
Внутри Cpython. Гид по интерпретатору Python,Шоу Энтони,Питер:Библиотека программиста,1972,2528,22,На складе
"40 алгоритмов, которые должен знать каждый программист на Python",Ахмад Имран,Питер:Библиотека программиста,1951,2501,22,На складе
Грокаем функциональное мышление,Норманд Эрик,Питер:Библиотека программиста,2552,3272,22,На складе
Структуры данных в С++. Учебное пособие,"Русакова Зинаида Николаевна, Рудаков Игорь Владимирович",Издательство МГТУ им. Н.Э.Баумана,448,814,45,На складе
Основы Python для Data Science,Берман Кеннеди,Питер:Библиотека программиста,2114,2710,22,На складе
Фундаментальные основы хакерства. Анализ программ в среде Win64,"Касперски Крис, Язев Юрий Евгеньевич",Солон-пресс:Программирование,2919,5307,45,На складе
Основы компьютерного моделирования и визуализации + Электронное приложение,Борзяк Андрей Александрович и др.,Лань:Компьютеры и программное обеспечение,6183,Цена без скидки не указана,Скидка отсутствует,На складе
UX/UI дизайн для создания идеального продукта. Полный и исчерпывающий гид,Шуваев Ярослав Александрович,Бомбора:Библиотека цифровой трансформации,1219,1670,27,На складе
Грокаем алгоритмы искусственного интеллекта,Харбанс Ришал,Питер:Библиотека программиста,1731,2219,22,На складе
Сделай видеоигру один и не свихнись,Грис Слава,АСТ:Видеоигры: глубокое погружение,669,916,27,На складе
Программирование в Unreal Engine 5 для начинающего игродела. Основы визуального языка Blueprint,"Максименкова Ольга Вениаминовна, Веселко Никита И.",Бомбора:Российский компьютерный бестселлер,1862,2551,27,На складе
C# 10 и .NET 6. Современная кросс-платформенная разработка,Прайс Марк Дж.,Питер:Для профессионалов,4808,6164,22,На складе
Computer Science для программиста-самоучки. Все что нужно знать о структурах данных и алгоритмах,Альтхофф Кори,Питер:Библиотека программиста,1412,1810,22,На складе
Непрерывное развитие API. Правильные решения в изменчивом технологическом ландшафте,Меджуи Мехди и др.,Питер:Бестселлеры O`Reilly,3795,4865,22,На складе
Head First. Изучаем Swift,"Мэннинг Джон, Баттфилд-Эддисон Пэрис",Питер:Head First (O'Reilly),2807,3599,22,На складе
Kubernetes изнутри,"Вьяс Джей, Лав Крис",ДМК-Пресс,2303,4187,45,На складе
С++ 20 в деталях,Райнер Гримм,ДМК-Пресс,2764,5026,45,На складе
"Математические алгоритмы для программистов. 3D-графика, машинное обучение и моделирование на Python",Орланд Пол,Питер:Библиотека программиста,3475,4455,22,На складе
Pandas в действии,Пасхавер Борис,Питер:Библиотека программиста,2738,3510,22,На складе
JavaScript и PHP. Content management system + Электронное приложение. Учебное пособие,Янцев Валерий Викторович,Лань:Компьютеры и программное обеспечение,3093,Цена без скидки не указана,Скидка отсутствует,На складе
Цифровая обработка изображений в OpenCv. Практикум. Учебное пособие,Матвеев Александр Иванович,Лань:Компьютеры и программное обеспечение,1237,Цена без скидки не указана,Скидка отсутствует,Ограничено
JavaScript и PHP. Content management system + Электронное приложение. Учебное пособие,Янцев Валерий Викторович,Лань:Компьютеры и программное обеспечение,3093,Цена без скидки не указана,Скидка отсутствует,Ограничено
C#. Программирование 2D и 3D векторной графики +CD. СПО,"Тюкачев Николай Аркадиевич, Хлебостроев Виктор Григорьевич",Лань:Компьютеры и программное обеспечение,2957,Цена без скидки не указана,Скидка отсутствует,Ограничено
Алгоритмизация и программирование. Практикум. СПО,Андрианова Анастасия Александровна,Лань:Компьютеры и программное обеспечение,2320,Цена без скидки не указана,Скидка отсутствует,На складе
Организация беспроводных Ad Hoc и Hot Spot сетей в среде ОС Windows,"Заяц Анатолий Моисеевич, Хабаров Сергей Петрович",Лань:Компьютеры и программное обеспечение,2338,Цена без скидки не указана,Скидка отсутствует,На складе
Построение распределенных систем на базе WebSocket. Учебное пособие,"Хабаров Сергей Петрович, Шилкина Мария Львовна",Лань:Компьютеры и программное обеспечение,2889,Цена без скидки не указана,Скидка отсутствует,Ограничено
Практическое введение в язык программирования Си. СПО,"Солдатенко Илья Сергеевич, Попов Иван Владимирович",Лань:Компьютеры и программное обеспечение,1492,Цена без скидки не указана,Скидка отсутствует,Ограничено
Проектирование и разработка WEB-приложений. Введение в frontend и backend разработку. СПО,"Заяц Анатолий Моисеевич, Васильев Николай Павлович",Лань:Компьютеры и программное обеспечение,1921,Цена без скидки не указана,Скидка отсутствует,Ограничено
Простой Python для опытных программистов,Гаско Рик,Солон-пресс:Программирование,845,1537,45,На складе
Профессиональная разработка на Python,Уилкс Мэттью,ДМК-Пресс,2918,5306,45,На складе
Основы Python. Научитесь мыслить как программист,Дауни Аллен Б.,"Манн, Иванов и Фербер",1461,2001,27,На складе
SimInTech. Преобразователи автономных источников электроэнергии,"Калачёв Юрий Николаевич, Александров А. Г.",ДМК-Пресс,1151,2093,45,На складе
JavaScript. Готовые программы. Учебное пособие,Янцев Валерий Викторович,Лань:Компьютеры и программное обеспечение,1966,Цена без скидки не указана,Скидка отсутствует,Ограничено
JavaScript. Готовые программы. СПО,Янцев Валерий Викторович,Лань:Компьютеры и программное обеспечение,2025,Цена без скидки не указана,Скидка отсутствует,На складе
TypeScript быстро,"Файн Яков, Моисеев Антон",Питер:Для профессионалов,2495,3199,22,На складе
C# 8 и .NET Core. Разработка и оптимизация,Прайс Марк Дж.,Питер:Для профессионалов,3457,4432,22,На складе
Разработка базы данных в Access. Учебное пособие,Волик Мария Владимировна,Прометей,370,672,45,На складе
Основы программирования на языке С. Учебное пособие,"Гагарина Лариса Геннадьевна, Дорогова Екатерина Георгиевна",ИНФРА-М:Высшее образование. Бакалавриат,1848,3360,45,На складе
Python. Быстрый старт,Чан Джейми,Питер:Библиотека программиста,1077,1381,22,На складе
C++ для профи,Лоспинозо Джош,Питер:Для профессионалов,3261,4181,22,На складе
Интеллектуальные информационные системы и методы искусственного интеллекта. Учебник,"Андрейчиков Александр Валентинович, Андрейчикова Ольга Николаевна",ИНФРА-М:Высшее образование. Магистратура,3519,6398,45,Ограничено
Инструментальные средства разработки программного обеспечения Системы Fossil,Орещенков Игорь Сергеевич,Лань:Компьютеры и программное обеспечение,3108,Цена без скидки не указана,Скидка отсутствует,На складе
"Эффективный Java. Тюнинг кода на Java 8, 11 и дальше",Оукс Скотт,Питер:Бестселлеры O`Reilly,3244,4159,22,На складе
gRPC. Запуск и эксплуатация облачных приложений. Go и Java для Docker и Kubernetes,"Индрасири Касун, Курупу Данеш",Питер:Бестселлеры O`Reilly,1715,2199,22,Ограничено
Python. Сборник упражнений,Стивенсон Бен,ДМК-Пресс,1074,1953,45,На складе
Совершенный алгоритм. Алгоритмы для NP-трудных задач,Рафгарден Тим,Питер:Библиотека программиста,1888,2421,22,На складе
"Стильный Java. Код, который работает всегда и везде",Фаэлла Марко,Питер:Библиотека программиста,2430,3116,22,На складе
Внедрение зависимостей на платформе .NET,"Симан Марк, Дерсен Стивен Ван",Питер:Для профессионалов,3244,4159,22,На складе
Карьера программиста,Лакман Макдауэлл Гейл,Питер:Библиотека программиста,2127,2727,22,На складе
Глубокое обучение. Легкая разработка проектов на Python,Вейдман Сет,Питер:Бестселлеры O`Reilly,2901,3719,22,На складе
Паттерны проектирования для C# и платформы .NET Core,"Арораа Гаурав, Чилберто Джеффри",Питер:Для профессионалов,3347,4291,22,На складе
Структуры и алгоритмы обработки данных. Учебник для СПО,"Павлов Леонид Александрович, Первова Наталия Викторовна",Лань:Компьютеры и программное обеспечение,1804,Цена без скидки не указана,Скидка отсутствует,Ограничено
Численные методы и программирование. Учебное пособие для СПО,Слабнов Виктор Дмитриевич,Лань:Компьютеры и программное обеспечение,5063,Цена без скидки не указана,Скидка отсутствует,На складе
Технология разработки программного обеспечения. Учебное пособие для СПО,Зубкова Татьяна Михайловна,Лань:Компьютеры и программное обеспечение,3440,Цена без скидки не указана,Скидка отсутствует,На складе
Изучаем C++ через программирование игр,Доусон Майкл,Питер,1417,1817,22,На складе
Совершенный софт. Совершенный софт - совершенная карьера,Леве Джувел,Питер:Для профессионалов,2214,2839,22,На складе
"Spark в действии. С примерами Java, Python и Scala",Перрен Жан-Жорж,ДМК-Пресс,3071,5583,45,На складе
Изучаем Power Query. Наглядный подход к подключению и преобразованию данных из множества источников,"Фоукс Линда, Спарроу Уоррен",ДМК-Пресс,1995,3628,45,На складе
Секреты Python Pro,Хиллард Дейн,Питер:Для профессионалов,2386,3059,22,Ограничено
Программирование на Python в примерах и задачах,Васильев Алексей Николаевич,Бомбора:Российский компьютерный бестселлер,1165,1596,27,На складе
Моделирование и оптимизация процессов управления в технологических системах. Учебник,"Колтунов Игорь Ильич, Крыжановская Татьяна Георгиевна",Кнорус:Магистратура,1005,1828,45,На складе
Квантовые вычисления. Прикладной подход,Хидари Джек Д.,ДМК-Пресс,1536,2793,45,На складе
JavaScript. Полное руководство,Флэнаган Дэвид,Вильямс,4436,8066,45,На складе
Проектирование информационных систем. Методы и средства структурно-функционального проектирования,"Гвоздева Татьяна Вадимовна, Баллод Борис Анатольевич",Лань:Компьютеры и программное обеспечение,1640,Цена без скидки не указана,Скидка отсутствует,Ограничено
Структуры дан.в C#.Лин.и нелин.динамич.структ.СПО,Симонова Елена Витальевна,Лань:Компьютеры и программное обеспечение,1749,Цена без скидки не указана,Скидка отсутствует,Ограничено
"Проектирование информационных систем. Стандартизация, техническое документирование информ. систем","Гвоздева Татьяна Вадимовна, Баллод Борис Анатольевич",Лань:Компьютеры и программное обеспечение,2154,Цена без скидки не указана,Скидка отсутствует,Ограничено
